{
  "schemaVersion": 1,
  "registryVersion": "alpha-2026-07-12-v1",
  "correctionProvenance": {
    "reason": "Canonical v1 example; review before deployment."
  },
  "projects": [
    {
      "id": "project-alpha",
      "name": "Example Project Alpha",
      "locations": {
        "repos": ["../../../example-project-alpha"],
        "evergreen": "../../../example-project-alpha/docs/evergreen.md",
        "beadsRoot": null,
        "summaries": ["./state/project-alpha/rarebit.jsonl"],
        "events": "./state/project-alpha/events.jsonl",
        "proposalDir": "./artifacts/proposals",
        "sourceDocs": ["../../../example-project-alpha/README.md"]
      },
      "associations": {},
      "evergreen": { "baseHash": "REPLACE_WITH_AUDITED_BASE_SHA256" }
    },
    {
      "id": "project-beta",
      "name": "Example Project Beta",
      "locations": {
        "repos": ["../../../example-project-beta"],
        "evergreen": "../../../example-project-beta/docs/evergreen.md",
        "beadsRoot": "../../../example-project-beta",
        "summaries": ["./state/project-beta/rarebit.jsonl"],
        "events": "./state/project-beta/events.jsonl",
        "proposalDir": "./artifacts/proposals",
        "sourceDocs": ["../../../example-project-beta/README.md"]
      },
      "associations": {},
      "evergreen": { "baseHash": "REPLACE_WITH_AUDITED_BASE_SHA256" }
    }
  ]
}
